source,source_url,title,company,location,salary_min,salary_max,currency,level,employment_type,remote_policy,description,requirements,benefits,posted_date
ITviec,https://example.com/itviec/ai-engineer,AI Engineer,ABC Tech,Hanoi,1000,2200,USD,junior,full-time,hybrid,"Build LLM applications, RAG pipelines, FastAPI services, and internal AI tools for Vietnamese customers.","Python, FastAPI, RAG, LangChain, PostgreSQL, Docker. LangGraph and monitoring are preferred.","13th salary, laptop, hybrid schedule",2026-05-20
TopDev,https://example.com/topdev/backend-ai,Backend AI Engineer,Lotus AI,Ho Chi Minh City,1200,2500,USD,middle,full-time,hybrid,"Develop backend APIs for AI products, integrate OpenAI and Gemini, and deploy services with Redis queues.","Python, FastAPI, Redis, Docker, PostgreSQL, REST API, Monitoring, CI/CD.","Health insurance, learning budget",2026-05-18
VietnamWorks,https://example.com/vietnamworks/rag-engineer,RAG Engineer,Nova Labs,Remote,1500,3000,USD,middle,full-time,remote,"Own retrieval augmented generation features, vector search quality, evaluation, and reranking.","RAG, Vector Search, Embedding, pgvector, Qdrant, LangChain, Reranking, Python.","Remote-first, stock options",2026-05-12
Glints,https://example.com/glints/ai-intern,AI Engineer Intern,SkyCode,Da Nang,400,800,USD,fresher,internship,on-site,"Assist the AI team with data preprocessing, prompt engineering, and prototype LLM features.","Python, Machine Learning, Prompt Engineering, SQL, GitHub Actions.","Mentorship, internship allowance",2026-05-21
JobsGO,https://example.com/jobsgo/ml-engineer,Machine Learning Engineer,VietData,Hanoi,1800,3500,USD,senior,full-time,on-site,"Build ML services, optimize model inference, and coordinate with backend teams.","Machine Learning, Deep Learning, Python, Docker, Kubernetes, Monitoring, PostgreSQL.","Performance bonus, training",2026-05-09
CareerViet,https://example.com/careerviet/fullstack-ai,Full Stack AI Developer,GreenStack,Ho Chi Minh City,900,1800,USD,junior,full-time,hybrid,"Build Next.js dashboards and FastAPI endpoints for AI workflows and agent traces.","Next.js, React, TypeScript, Tailwind CSS, FastAPI, Pydantic, Docker.","Flexible hours, product ownership",2026-05-23

